22:29:52.280383 IP server2.ssh > 192.168.56.102.34816: Flags [P.], seq 3291156008:3291156204, ack 3743965109, win 501, options [nop,nop,TS val 3623431860 ecr 1306786258], length 196
22:29:52.280790 IP 192.168.56.102.34816 > server2.ssh: Flags [.], ack 196, win 501, options [nop,nop,TS val 1306786307 ecr 3623431860], length 0
22:29:52.281141 IP 192.168.56.102.ssh > server2.60724: Flags [P.], seq 1022873840:1022874036, ack 2673219452, win 501, options [nop,nop,TS val 1306786307 ecr 3623431812], length 196
22:29:52.281197 IP server2.60724 > 192.168.56.102.ssh: Flags [.], ack 196, win 501, options [nop,nop,TS val 3623431860 ecr 1306786307], length 0
22:29:57.800548 IP 192.168.56.1.57609 > 239.255.255.250.1900: UDP, length 175
22:29:58.801056 IP 192.168.56.1.57609 > 239.255.255.250.1900: UDP, length 175
22:29:59.801003 IP 192.168.56.1.57609 > 239.255.255.250.1900: UDP, length 175
22:30:00.801235 IP 192.168.56.1.57609 > 239.255.255.250.1900: UDP, length 175

